CODIGO_DA_IES,NOME_DA_IES,CATEGORIA_DA_IES,MUNICIPIO,UF,SITUACAO_IES
22093,Faculdade AGES de Medicina,Privada,Jacobina,BA,Ativa
22102,Faculdade de Tecnologia Senac Curitiba Portão,Privada,Curitiba,PR,Ativa
17889,FACULDADE IBG,Privada,Rondonópolis,MT,Ativa
688,UNIVERSIDADE ESTADUAL DO SUDOESTE DA BAHIA,Pública,Vitória da Conquista,BA,Ativa
13625,FACULDADE DE TECNOLOGIA NOVA PALHOÇA,Privada,Palhoça,SC,Ativa
1295,FACULDADE DE EDUCAÇÃO E TECNOLOGIA IRACEMA,Privada,São Paulo,SP,Ativa
649,CENTRO UNIVERSITÁRIO DE UNIÃO DA VITÓRIA,Pública,União da Vitória,PR,Ativa
21586,Faculdade Maurício de Nassau de Betim,Privada,Betim,MG,Extinta
1783,FACULDADE DE CIÊNCIAS SOCIAIS APLICADAS,Privada,Xaxim,SC,Ativa
4330,FACULDADE EFICAZ,Privada,Maringá,PR,Ativa
13684,FACULDADE ANHANGUERA DE CONTAGEM,Privada,Contagem,MG,Ativa
18684,Faculdade Santa Teresa,Privada,Manaus,AM,Ativa
3573,FACULDADE TEOLÓGICA BATISTA DE BRASÍLIA,Privada,Brasília,DF,Ativa
14258,INSTITUTO SUPERIOR DE ENSINO E PESQUISA DE CAMBUÍ,Privada,Cambuí,MG,Extinta
3984,FUNDAÇÃO UNIVERSIDADE FEDERAL DO VALE DO SÃO FRANCISCO,Pública,Petrolina,PE,Ativa
14401,FACULDADE DE TECNOLOGIA PORTO DAS MONÇÕES,Privada,Porto Feliz,SP,Ativa
13073,FACULDADE DE TECNOLOGIA AEROTD,Privada,Florianópolis,SC,Ativa
226,CENTRO UNIVERSITÁRIO LUSÍADA,Privada,Santos,SP,Ativa
202,FACULDADE DO RIO DE JANEIRO,Privada,Rio de Janeiro,RJ,Ativa
18075,FACULDADE UNINASSAU JABOATÃO DOS GUARARAPES,Privada,Jaboatão dos Guararapes,PE,Ativa
4025,FACULDADE DE TECNOLOGIA DE SÃO JOSÉ DO RIO PRETO,Pública,São José do Rio Preto,SP,Ativa
1772,Centro Universitário Fanor Wyden,Privada,Fortaleza,CE,Ativa
1838,FACULDADES INTEGRADAS RIO BRANCO,Privada,São Paulo,SP,Ativa
5186,INSTITUTO ASSIS GURGACZ,Privada,Cascavel,PR,Extinta
3527,FACULDADE CATÓLICA DOM AQUINO DE CUIABÁ,Privada,Cuiabá,MT,Extinta
30,UNIVERSIDADE JOSÉ DO ROSÁRIO VELLANO,Privada,Alfenas,MG,Ativa
15015,Universidade Estadual do Norte do Paraná,Pública,Jacarezinho,PR,Ativa
3849,FUNDAÇÃO UNIVERSIDADE FEDERAL DO TOCANTINS,Pública,Palmas,TO,Ativa
20622,FACULDADE UNIRB - CAMAÇARI,Privada,Camaçari,BA,Ativa
14219,Faculdade Presidente Antônio Carlos de Liberdade,Privada,Liberdade,MG,Extinta
1049,INSTITUTO DE ENSINO SUPERIOR FUCAPI,Privada,Manaus,AM,Ativa
1632,Faculdade Pitágoras Unopar Anhanguera de Londrina,Privada,Londrina,PR,Ativa
24558,FACULDADE INBEC,Privada,Fortaleza,CE,Ativa
3691,FACULDADE DE TECNOLOGIA TUPY DE SÃO BENTO DO SUL,Privada,São Bento do Sul,SC,Ativa
1332,FACULDADE DE COMUNICAÇÃO SOCIAL DE HORTOLÂNDIA,Privada,Hortolândia,SP,Extinta
15746,Faculdade de Tecnologia do Ipiranga,Pública,São Paulo,SP,Ativa
431,FACULDADE DE MEDICINA DE MARÍLIA,Pública,Marília,SP,Ativa
198,CENTRO UNIVERSITÁRIO DA CIDADE,Privada,Rio de Janeiro,RJ,Extinta
1449,FACULDADE DE IBAITI,Privada,Ibaiti,PR,Ativa
22090,FACULDADE DE CIÊNCIAS DA SAÚDE DO GRUPO HOSPITALAR CONCEIÇÃO,Privada,Porto Alegre,RS,Ativa
3710,ESCOLA SUPERIOR NACIONAL DE SEGUROS,Privada,Rio de Janeiro,RJ,Ativa
4009,FACULDADE DE TECNOLOGIA ESTÁCIO DE CURITIBA,Privada,Curitiba,PR,Ativa
35,FACULDADE DE TECNOLOGIA DE AMERICANA,Pública,Americana,SP,Ativa
24462,CENTRO DE EDUCAÇÃO TECNOLÓGICO DA FUNDAÇÃO INDAIATUBANA DE EDUCAÇÃO E CULTURA,Pública,Indaiatuba,SP,Ativa
23117,Faculdades FAMEP Unidade Fortaleza  CE,Privada,Fortaleza,CE,Ativa
23178,Centro de Ensino Superior de Sete Lagoas,Privada,Sete Lagoas,MG,Ativa
17226,Faculdade Cesmac do Agreste,Privada,Arapiraca,AL,Ativa
5592,Centro Universitário Funorte,Privada,Montes Claros,MG,Ativa
2443,FACULDADE FUNORTE DE JANAÚBA,Privada,Janaúba,MG,Ativa
5670,CENTRO UNIVERSITÁRIO DO VALE DO ARAGUAIA,Privada,Barra do Garças,MT,Ativa
1800,Faculdade REGES de Realeza,Privada,Realeza,PR,Ativa
23893,Faculdade Anhanguera de Itapetininga,Privada,Itapetininga,SP,Ativa
203,UNIVERSIDADE SÃO JUDAS TADEU,Privada,São Paulo,SP,Ativa
15682,Faculdade de Tecnologia de Piracicaba,Pública,Piracicaba,SP,Ativa
1638,FACULDADE DO AMAZONAS,Privada,Manaus,AM,Ativa
18751,Faculdade Malta,Privada,Teresina,PI,Ativa
93,FACULDADE DE MEDICINA DE JUNDIAÍ,Privada,Jundiaí,SP,Ativa
18745,Faculdade de Ciências Aplicadas Piauiense,Privada,Campo Maior,PI,Ativa
1497,FACULDADE DE ADMINISTRAÇÃO DE SANTA CRUZ DO RIO PARDO,Privada,Santa Cruz do Rio Pardo,SP,Ativa
14173,Faculdade Presidente Antônio Carlos de Ribeirão das Neves,Privada,Ribeirão das Neves,MG,Extinta
17326,FACULDADE GIANNA BERETTA,Privada,São Luís,MA,Ativa
3690,FACULDADE PEDRO II,Privada,Belo Horizonte,MG,Ativa
295,UNIVERSIDADE DE SANTA CRUZ DO SUL,Privada,Santa Cruz do Sul,RS,Ativa
14890,FACULDADE PRAIA GRANDE,Privada,Praia Grande,SP,Ativa
296,Centro Universitário da Região da Campanha,Privada,Bagé,RS,Ativa
12416,FACULDADE BRASILIENSE DE NEGÓCIOS,Privada,Brasília,DF,Extinta
19319,FACULDADE METROPOLITANA DE TERESINA,Privada,Teresina,PI,Ativa
1669,INSTITUTO METROPOLITANO DE ENSINO SUPERIOR,Privada,Ipatinga,MG,Ativa
84,FACULDADE DE FILOSOFIA CIÊNCIAS E LETRAS DE MACAÉ,Privada,Macaé,RJ,Extinta
2319,ESCOLA SUPERIOR DE EDUCAÇÃO CORPORATIVA,Privada,São José,SC,Ativa
3184,"INSTITUTO FEDERAL DE EDUCAÇÃO, CIÊNCIA E TECNOLOGIA DE RORAIMA",Pública,Boa Vista,RR,Ativa
573,UNIVERSIDADE FEDERAL DO ESPÍRITO SANTO,Pública,Vitória,ES,Ativa
1779,FACULDADE AIEC,Privada,Brasília,DF,Ativa
17738,Faculdade Cesgranrio,Privada,Rio de Janeiro,RJ,Ativa
19793,FACULDADE FADAM DE MARACANAÚ,Privada,Fortaleza,CE,Ativa
23799,FACULDADE EXATA EDUCACIONAL,Privada,Curitiba,PR,Ativa
882,INSTITUTO MUNICIPAL DE ENSINO SUPERIOR DE BEBEDOURO VICTÓRIO CARDASSI,Pública,Bebedouro,SP,Ativa
2826,FACULDADE NOSSA SENHORA DE FÁTIMA,Privada,Caxias do Sul,RS,Ativa
2053,FACULDADE PARA O DESENVOLVIMENTO DE PERNAMBUCO,Privada,Recife,PE,Extinta
23095,Instituto SOCIESC de Jaraguá do Sul,Privada,Jaraguá do Sul,SC,Ativa
21681,FACULDADE UNIVEST DE EDUCAÇÃO,Privada,Cuiabá,MT,Ativa
5451,FACULDADE ANHANGÜERA DE BAURU,Privada,Bauru,SP,Ativa
4259,FACULDADE DE INHUMAS - FAC-MAIS,Privada,Inhumas,GO,Ativa
2525,FACULDADE PAULISTA DE CIÊNCIAS APLICADAS,Privada,São Paulo,SP,Extinta
1155,FACULDADE SALESIANA DE SANTA TERESA,Privada,Corumbá,MS,Ativa
21287,FACULDADE ESTÁCIO DE CASCAVEL,Privada,Cascavel,PR,Extinta
1663,Centro Universitário Araguaia,Privada,Goiânia,GO,Ativa
4169,Faculdade Estácio de Carapicuíba,Privada,Carapicuíba,SP,Ativa
24257,Instituto de Direito do Norte - IDN Manaus,Privada,Manaus,AM,Ativa
22100,Faculdade de Direito 8 de Julho,Privada,Aracaju,SE,Ativa
18160,FACULDADES INTEGRADAS TOLEDO DE TRÊS LAGOAS,Privada,Três Lagoas,MS,Extinta
19198,FACULDADE DE TECNOLOGIA E EDUCAÇÃO DE GOIÁS,Privada,Senador Canedo,GO,Ativa
3155,FACULDADE DE TECNOLOGIA SENAI JARAGUÁ DO SUL,Privada,Jaraguá do Sul,SC,Ativa
11902,FACULDADE DE TECNOLOGIA E DESENVOLVIMENTO DE COMPETÊNCIAS,Privada,Belém,PA,Ativa
802,CENTRO UNIVERSITÁRIO UNICARIOCA,Privada,Rio de Janeiro,RJ,Ativa
23123,Faculdade Americas International College,Privada,São Paulo,SP,Ativa
18650,UNAMA FACULDADE DA AMAZÔNIA DE RIO BRANCO,Privada,Rio Branco,AC,Ativa
22196,Faculdade de Direito Serra Dourada,Privada,Altamira,PA,Ativa
1428,INSTITUTO DE ENSINO SUPERIOR PLANALTO,Privada,Brasília,DF,Ativa
1750,UNIDADE DE ENSINO SUPERIOR EXPOENTE,Privada,Curitiba,PR,Extinta
21224,FACULDADE INTERNACIONAL CIDADE VIVA,Privada,João Pessoa,PB,Ativa
24026,Instituto de Serra Dourada,Privada,Lorena,SP,Ativa
2969,INSTITUTO SUPERIOR DE EDUCAÇÃO OCIDENTE,Privada,Salvador,BA,Ativa
8,UNIVERSIDADE FEDERAL DE VIÇOSA,Pública,Viçosa,MG,Ativa
1246,FACULDADE CANDIDO MENDES DE VITÓRIA,Privada,Vitória,ES,Extinta
3308,FACULDADE ENGENHEIRO SALVADOR ARENA,Privada,São Bernardo do Campo,SP,Ativa
24368,FACULDADE MARECHAL RONDON DE GUARULHOS,Privada,Guarulhos,SP,Ativa
3001,FACULDADE CENECISTA DE RONDONÓPOLIS,Privada,Rondonópolis,MT,Extinta
1998,INSTITUTO SUPERIOR DE EDUCAÇÃO ELVIRA DAYRELL,Privada,Virginópolis,MG,Ativa
18729,FACULDADES IPEDE,Privada,Codó,MA,Ativa
24211,Instituto Amazônico de Ensino Superior,Privada,Manaus,AM,Ativa
18450,FACULDADE IDEAL DE ALTO HORIZONTE,Privada,Alto Horizonte,GO,Extinta
2271,FACULDADE ANHANGUERA DE IPATINGA,Privada,Ipatinga,MG,Ativa
12748,"FETAC - FACULDADE DE EDUCAÇÃO, TECNOLOGIA E ADMINISTRAÇÃO DE CAARAPÓ",Privada,Caarapó,MS,Ativa
2804,FACULDADE CCAA,Privada,Rio de Janeiro,RJ,Extinta
1574,FACULDADE EDUCACIONAL DE MEDIANEIRA,Privada,Medianeira,PR,Ativa
22521,FACULDADES FAMEP Unidade Irará - BA,Privada,Irará,BA,Ativa
2395,FACULDADE DE CAMPO VERDE,Privada,Campo Verde,MT,Extinta
11860,INSTITUTO NACIONAL DE ENSINO SUPERIOR E PÓS-GRADUAÇÃO PADRE GERVÁSIO,Privada,Pouso Alegre,MG,Ativa
21713,Faculdade de Tecnologia - Fatec de Ribeirão Preto,Pública,Ribeirão Preto,SP,Ativa
18145,Faculdade Estácio de São José do Rio Preto,Privada,São José do Rio Preto,SP,Extinta
17831,Faculdade de Tecnologia e Negócios de Catalão,Privada,Catalão,GO,Ativa
5204,INSTITUTO SUPERIOR DE EDUCAÇÃO ANTONINO FREIRE - ISEAF,Pública,Teresina,PI,Ativa
1902,FACULDADE SANTO AGOSTINHO,Privada,Ipiaú,BA,Ativa
20105,Faculdade de Ciências e Saúde Edufor,Privada,São Luís,MA,Ativa
3607,ESCOLA SUPERIOR ASSOCIADA DE GOIÂNIA,Privada,Goiânia,GO,Ativa
923,CENTRO UNIVERSITÁRIO SÃO ROQUE,Privada,São Roque,SP,Ativa
437,UNIVERSIDADE PARANAENSE,Privada,Umuarama,PR,Ativa
1443,FACULDADE VIVA VITÓRIA,Privada,Vitória,ES,Ativa
4289,FACULDADE DO VALE ELVIRA DAYRELL - FAVED,Privada,Virginópolis,MG,Ativa
1817,Faculdade Estácio de Curitiba,Privada,Curitiba,PR,Ativa
1539,FACULDADE ÍTALO BRASILEIRA,Pública,Cariacica,ES,Extinta
24527,FACULDADE DE ENSINO SUPERIOR REFFERENCIAL,Privada,Campo Grande,MS,Ativa
1232,CENTRO UNIVERSITÁRIO CAMPOS DE ANDRADE,Privada,Curitiba,PR,Ativa
3678,FACULDADE DE TECNOLOGIA DO VALE DO ITAJAÍ,Privada,Blumenau,SC,Extinta
269,FACULDADE FACCAT,Privada,Tupã,SP,Ativa
18114,Faculdade Fasipe Mato Grosso,Privada,Cuiabá,MT,Ativa
2140,FACULDADE NOSSA SENHORA DE LOURDES,Privada,Porto Seguro,BA,Ativa
17559,FACULDADE LOGOS,Privada,Novo Gama,GO,Ativa
3193,FACULDADES INTEGRADAS DOS CAMPOS GERAIS,Privada,Ponta Grossa,PR,Ativa
245,FACULDADE DE ADMINISTRAÇÃO,Privada,São Paulo,SP,Extinta
662,FACULDADES INTEGRADAS CORAÇÃO DE JESUS,Privada,Santo André,SP,Extinta
1812,"INSTITUTO FEDERAL DE EDUCAÇÃO, CIÊNCIA E TECNOLOGIA  DO AMAZONAS",Pública,Manaus,AM,Ativa
15704,Faculdade de Tecnologia de Capão Bonito,Pública,Capão Bonito,SP,Ativa
577,UNIVERSIDADE FEDERAL DE ALAGOAS,Pública,Maceió,AL,Ativa
1970,Faculdade Multivix de Cachoeiro,Privada,Cachoeiro de Itapemirim,ES,Ativa
527,PONTIFÍCIA UNIVERSIDADE CATÓLICA DE GOIÁS,Privada,Goiânia,GO,Ativa
13498,FACULDADE DE TECNOLOGIA DE BARRETOS,Privada,Barretos,SP,Extinta
15894,SOBRESP - Faculdade de Ciências da Saúde,Privada,Santa Maria,RS,Ativa
1267,INSTITUTO DE ENSINO SUPERIOR DA GRANDE FLORIANÓPOLIS,Privada,São José,SC,Ativa
17355,Faculdade de Educação em Ciências da Saúde,Privada,São Paulo,SP,Ativa
3774,FACULDADE SÃO TOMAZ DE AQUINO,Privada,Salvador,BA,Ativa
3648,INSTITUTO DE ENSINO SUPERIOR DE CUIABÁ,Privada,Cuiabá,MT,Ativa
16245,FACULDADE ESCOLA DE NEGÓCIOS EXCELLENCE,Privada,São Luís,MA,Ativa
19408,Faculdade AGES de Jacobina,Privada,Jacobina,BA,Ativa
22101,Faculdade de Educação de Patos de Minas,Privada,Patos de Minas,MG,Ativa
19859,FACULDADE UNIFAMETRO CASCAVEL,Privada,Cascavel,CE,Ativa
149,FACULDADE DE MEDICINA DE SÃO JOSÉ DO RIO PRETO,Pública,São José do Rio Preto,SP,Ativa
11308,FACULDADE ANHANGUERA DE SUMARÉ,Privada,Sumaré,SP,Ativa
283,FACULDADE DE EDUCAÇÃO COSTA BRAGA,Privada,São Paulo,SP,Extinta
14027,Faculdade Presidente Antônio Carlos de Matozinhos,Privada,Matozinhos,MG,Extinta
693,UNIVERSIDADE FEDERAL DO ESTADO DO RIO DE JANEIRO,Pública,Rio de Janeiro,RJ,Ativa
755,CENTRO DE ENSINO SUPERIOR DE JATAÍ,Privada,Jataí,GO,Ativa
2961,Faculdade Estácio do Pantanal,Privada,Cáceres,MT,Ativa
23908,FACULDADE SÃO FRANCISCO DO CEARÁ - CRATO,Privada,Crato,CE,Ativa
1305,"FACULDADE ANHANGUERA DE CIÊNCIAS JURÍDICAS, GERENCIAIS E EDUCAÇÃO DE SINOP",Privada,Sinop,MT,Ativa
1135,FACULDADE PLANALTO DE CIÊNCIA DA COMPUTAÇÃO,Privada,Brasília,DF,Extinta
15272,"FACULDADE DE TECNOLOGIA, EDUCAÇÃO SUPERIOR E PROFISSIONAL",Privada,Teresina,PI,Ativa
5019,INSTITUTO SUPERIOR DE EDUCAÇÃO DA ZONA OESTE,Pública,Rio de Janeiro,RJ,Ativa
5180,FACULDADE DO POVO,Privada,São Paulo,SP,Extinta
2532,FACULDADE DO SUDESTE GOIANO,Privada,Pires do Rio,GO,Ativa
530,FACULDADE DE MÚSICA DO ESPÍRITO SANTO MAURÍCIO DE OLIVEIRA,Pública,Vitória,ES,Ativa
3854,FACULDADE IBRA DE BRASÍLIA,Privada,Brasília,DF,Ativa
4821,FACULDADE PROMINAS DE MONTES CLAROS,Privada,Montes Claros,MG,Ativa
14118,Faculdade Presidente Antônio Carlos de Raul Soares,Privada,Raul Soares,MG,Extinta
5044,FACULDADE DE DIREITO DE GARANHUNS,Pública,Garanhuns,PE,Extinta
3216,FACULDADE DE CIÊNCIAS DA BAHIA - FACIBA,Privada,Salvador,BA,Ativa
21834,Faculdade Anhanguera de Marilia,Privada,Marília,SP,Extinta
2942,INSTITUTO SUPERIOR DE EDUCAÇÃO FRANCISCANO NOSSA SENHORA DE FÁTIMA,Privada,Brasília,DF,Extinta
18648,Faculdade Uninassau Arapiraca,Privada,Arapiraca,AL,Ativa
1448,FACULDADE DO CENTRO EDUCACIONAL DE NITERÓI,Privada,Niterói,RJ,Extinta
1413,FACULDADE DE PRIMAVERA,Privada,Rosana,SP,Ativa
19215,ESCOLA DE CONTAS E CAPACITAÇÃO PROFESSOR PEDRO ALEIXO,Pública,Belo Horizonte,MG,Ativa
3595,INSTITUTO SUPERIOR DE EDUCAÇÃO DE SANTA MARIA DA VITÓRIA,Privada,Santa Maria da Vitória,BA,Extinta
1643,FACULDADE ANÍSIO TEIXEIRA DE FEIRA DE SANTANA,Privada,Feira de Santana,BA,Ativa
3116,FACULDADE SANTO AGOSTINHO DE PIRAPORA,Privada,Pirapora,MG,Extinta
15453,Faculdade Presidente Antônio Carlos de Conselheiro Lafaiete,Privada,Conselheiro Lafaiete,MG,Ativa
1239,FACULDADE PADRÃO,Privada,Goiânia,GO,Ativa
25365,Faculdade FAMEP - Unidade Parambu - CE,Privada,Parambu,CE,Ativa
16410,Faculdade de Tecnologia de Catanduva,Pública,Catanduva,SP,Ativa
2468,INSTITUTO TEOLÓGICO FRANCISCANO,Privada,Petrópolis,RJ,Ativa
24168,Faculdade Unida de São Paulo,Privada,São Paulo,SP,Ativa
4454,FACULDADE PITÁGORAS DE NOVA LIMA,Privada,Nova Lima,MG,Extinta
42,FACULDADE ESTADUAL DE DIREITO DO NORTE PIONEIRO,Pública,Jacarezinho,PR,Extinta
17882,FACULDADE ESCOLA POLITÉCNICA DE INOVAÇÃO E CONHECIMENTO APLICADO,Privada,Blumenau,SC,Ativa
24190,Faculdade Barros Melo Recife,Privada,Recife,PE,Ativa
535,"FUNDAÇÃO FACULDADE DE FILOSOFIA, CIÊNCIAS E LETRAS DE MANDAGUARI",Pública,Mandaguari,PR,Ativa
727,"FACULDADE DE FILOSOFIA, CIÊNCIAS E LETRAS DO ALTO SÃO FRANCISCO",Privada,Luz,MG,Ativa
5218,FACULDADE DE TECNOLOGIA PROFESSOR WALDOMIRO MAY,Pública,Cruzeiro,SP,Extinta
15449,Centro Universitário Presidente Antônio Carlos de Araguari,Privada,Araguari,MG,Extinta
4667,FACULDADE RIO SONO,Privada,Pedro Afonso,TO,Extinta
18073,Faculdade Fasipe Cuiabá,Privada,Cuiabá,MT,Ativa
2317,FACULDADE DO DESCOBRIMENTO,Privada,Santa Cruz Cabrália,BA,Extinta
12817,FACULDADE IMESP MONITOR,Privada,São Paulo,SP,Ativa
1204,FACULDADE DE AMAMBAI,Privada,Amambaí,MS,Ativa
831,FACULDADE DE CIÊNCIAS HUMANAS DO VALE DO RIO GRANDE,Privada,Olímpia,SP,Extinta
1884,FACULDADE DE RANCHARIA,Privada,Rancharia,SP,Ativa
18463,Faculdade UniFAHE,Privada,Mundo Novo,MS,Ativa
14221,Faculdade Presidente Antônio Carlos de São Domingos do Prata,Privada,São Domingos do Prata,MG,Extinta
2579,CENTRO UNIVERSITÁRIO ATENAS,Privada,Paracatu,MG,Ativa
21814,"Instituto de Pesquisas, Ensino e Gestão em Saúde",Privada,Porto Alegre,RS,Ativa
5599,LIBERTAS - FACULDADES INTEGRADAS,Privada,São Sebastião do Paraíso,MG,Ativa
19587,FACULDADES JOÃO PAULO II - PELOTAS,Privada,Pelotas,RS,Ativa
607,FACULDADE DE CIÊNCIAS CONTÁBEIS E ADMINISTRATIVAS DE CACHOEIRO DO ITAPEMIRIM,Privada,Cachoeiro de Itapemirim,ES,Ativa
3533,FACULDADE CERES,Privada,São José do Rio Preto,SP,Ativa
2702,FACULDADE DE CIÊNCIAS JURÍDICAS DE PARAÍSO DO TOCANTINS,Privada,Paraíso do Tocantins,TO,Ativa
73,CENTRO DE ENSINO SUPERIOR DE ARCOVERDE,Pública,Arcoverde,PE,Ativa
1285,INSTITUTO DE ENSINO SUPERIOR DE MAIRIPORÃ,Privada,Mairiporã,SP,Extinta
2617,FACULDADE SÃO BENTO DO RIO DE JANEIRO,Privada,Rio de Janeiro,RJ,Ativa
19299,Faculdade Pitagoras de Petrolina,Privada,Petrolina,PE,Extinta
14194,FATEC - FACULDADE DE TEOLOGIA E CIÊNCIAS DE VOTUPORANGA,Privada,Votuporanga,SP,Ativa
2619,FACULDADE DE DIREITO DE ITABIRA,Privada,Itabira,MG,Extinta
2247,Faculdade Paulista São José,Privada,São Paulo,SP,Extinta
1569,FACULDADES INTEGRADAS DE ARARAQUARA,Privada,Araraquara,SP,Ativa
4672,FACULDADE EMPREENDEDORA AURORA,Privada,Caçador,SC,Extinta
22267,Faculdade HONPAR,Privada,Arapongas,PR,Ativa
1429,FACULDADE BATISTA DO RIO DE JANEIRO,Privada,Rio de Janeiro,RJ,Ativa
3042,CHRISTUS FACULDADE DO PIAUÍ,Privada,Piripiri,PI,Ativa
23025,Faculdade de Ensino Superior Brasileira - Faculdade FEBRAS,Privada,Vila Velha,ES,Ativa
2788,FACULDADE DE CIÊNCIAS AMBIENTAIS DE CARATINGA,Privada,Caratinga,MG,Extinta
546,PONTIFÍCIA UNIVERSIDADE CATÓLICA DE SÃO PAULO,Privada,São Paulo,SP,Ativa
2343,Centro Universitário U:VERSE,Privada,Rio Branco,AC,Ativa
1513,FACULDADE PITÁGORAS INSTITUTO CAMILLO FILHO,Privada,Teresina,PI,Ativa
15383,FACULDADE PARA O DESENVOLVIMENTO SUSTENTÁVEL DA AMAZÔNIA,Privada,Parauapebas,PA,Ativa
2371,INSTITUTO DE EDUCAÇÃO SUPERIOR SÃO FRANCISCO DE ASSIS DE TEÓFILO OTONI,Privada,Teófilo Otoni,MG,Extinta
19,PONTIFÍCIA UNIVERSIDADE CATÓLICA DE CAMPINAS,Privada,Campinas,SP,Ativa
692,FACULDADE DE PETROLINA,Pública,Petrolina,PE,Ativa
21433,FACULDADE DÍNAMO EDUCAÇÃO,Privada,Belém,PA,Extinta
21108,Faculdade São Judas de Terra Boa,Privada,Terra Boa,PR,Ativa
20070,Faculdade Primeiro de Janeiro,Privada,Crateús,CE,Ativa
426,UNIVERSIDADE FRANCISCANA,Privada,Santa Maria,RS,Ativa
1580,FACULDADE DE CIÊNCIAS E EDUCAÇÃO SENA AIRES,Privada,Valparaíso de Goiás,GO,Ativa
15639,Faculdade de Tecnologia de Itaquaquecetuba,Pública,Itaquaquecetuba,SP,Ativa
1886,FACULDADE DE MONTE ALTO,Privada,Monte Alto,SP,Extinta
3991,FACULDADE DE TECNOLOGIA SÃO MATEUS,Privada,Porto Velho,RO,Extinta
222,CENTRO UNIVERSITÁRIO DE VOTUPORANGA,Privada,Votuporanga,SP,Ativa
21459,FACULDADE DOM BOSCO DE MARINGA,Privada,Maringá,PR,Ativa
23151,FACULDADE EDUCAR DA IBIAPABA,Privada,Ipu,CE,Ativa
18370,FACULDADE INOVA,Privada,Palmas,PR,Extinta
294,FACULDADE TRÊS DE MAIO,Privada,Três de Maio,RS,Ativa
1157,ESCOLA SUPERIOR SÃO FRANCISCO DE ASSIS,Privada,Santa Teresa,ES,Ativa
415,FACULDADE DE CIÊNCIAS MÉDICAS DA SANTA CASA SÃO PAULO,Privada,São Paulo,SP,Ativa
1647,FACULDADE DE ENSINO E CULTURA DO CEARÁ,Privada,Fortaleza,CE,Ativa
22139,FACULDADE SANTO ANTONIO DE ITABUNA,Privada,Itabuna,BA,Ativa
19861,Faculdade de Santana de Parnaíba,Privada,Santana de Parnaíba,SP,Ativa
4428,FACULDADE PROFESSOR MIGUEL ÂNGELO DA SILVA SANTOS,Privada,Macaé,RJ,Ativa
21552,FACULDADE ANHANGUERA DE RIO BRANCO,Privada,Rio Branco,AC,Ativa
4740,Faculdade de Tecnologia e Ciências do Alto Paranaíba,Privada,Patrocínio,MG,Ativa
220,FACULDADE SÃO JUDAS TADEU,Privada,Rio de Janeiro,RJ,Ativa
17977,Faculdade de Tecnologia de Itaquera,Pública,São Paulo,SP,Ativa
21554,Faculdade Anhanguera de Itapeva,Privada,Itapeva,SP,Ativa
2726,FACULDADE BILAC DE SÃO JOSÉ DOS CAMPOS,Privada,São José dos Campos,SP,Ativa
18509,FACULDADE SOLIDÁRIA DE SOBRADINHO,Privada,Brasília,DF,Ativa
4656,FACULDADE ANHANGÜERA DE PIRACICABA,Privada,Piracicaba,SP,Ativa
18038,Faculdade de Tecnologia IPENO,Privada,Florianópolis,SC,Extinta
22684,Faculdade Unicentral,Privada,Campo Verde,MT,Ativa
1528,FACULDADE DE CIÊNCIAS HUMANAS SÃO PAULO,Privada,São Paulo,SP,Extinta
81,UNIVERSIDADE DA REGIÃO DE JOINVILLE,Privada,Joinville,SC,Ativa
11697,FACULDADE SERIGY,Privada,Aracaju,SE,Extinta
25624,CEDDU - CENTRO DE ENSINO SUPERIOR,Privada,Cacimbinhas,AL,Ativa
15280,"Faculdade Brasileira de Ensino, Pesquisa e Extensão",Privada,João Pessoa,PB,Ativa
25788,Faculdade Leonardo da Vinci de São Gonçalo,Privada,São Gonçalo,RJ,Ativa
516,CENTRO UNIVERSITÁRIO DO RIO DE JANEIRO,Privada,Rio de Janeiro,RJ,Ativa
1508,Centro Universitário Metropolitano de Maringá,Privada,Maringá,PR,Ativa
2770,Centro Universitário FACUNICAMPS,Privada,Goiânia,GO,Ativa
22154,Faculdade de Ciências Jurídicas de Jacobina,Privada,Jacobina,BA,Ativa
1789,FACULDADE CATUAÍ,Privada,Cambé,PR,Ativa
1288,FACULDADE INDEPENDENTE BUTANTÃ,Privada,São Paulo,SP,Extinta
15054,CENTRO UNIVERSITÁRIO UNIVERSO RECIFE,Privada,Recife,PE,Ativa
17025,Faculdade de Educação Superior de Paragominas,Privada,Paragominas,PA,Ativa
20570,Faculdade Alpha,Privada,Recife,PE,Ativa
21931,Faculdade Una de Jataí,Privada,Jataí,GO,Ativa
22112,Faculdade Pitágoras de Aracati,Privada,Aracati,CE,Extinta
18799,Faculdade Itataia,Privada,Santa Quitéria,CE,Ativa
3785,INSTITUTO MARANHENSE DE ENSINO E CULTURA,Privada,São Luís,MA,Ativa
1538,CENTRO UNIVERSITARIO PROJEÇÃO,Privada,Brasília,DF,Ativa
2929,FACULDADE DE MILAGRES CEARÁ,Privada,Milagres,CE,Extinta
1725,FACULDADE XV DE AGOSTO,Privada,Socorro,SP,Ativa
23273,Faculdade UNA de Itumbiara,Privada,Itumbiara,GO,Ativa
2037,FACULDADE UNIME DE CIÊNCIAS EXATAS E TECNOLÓGICAS,Privada,Lauro de Freitas,BA,Ativa
4006,FACULDADE DE TECNOLOGIA SENAC PELOTAS,Privada,Pelotas,RS,Ativa
1847,FACULDADE ANHANGUERA DE IMPERATRIZ,Privada,Imperatriz,MA,Ativa
21876,EJ - Faculdade de Tecnologia em Aviação Civil,Privada,Itápolis,SP,Ativa
21215,Faculdade de Ensino de Pesquisa do Cooperativismo,Privada,Cuiabá,MT,Ativa
3183,"INSTITUTO FEDERAL DE EDUCAÇÃO, CIÊNCIA E TECNOLOGIA DE SERGIPE",Pública,Aracaju,SE,Ativa
2275,FACULDADE SANTO AGOSTINHO,Privada,Montes Claros,MG,Ativa
1191,INSTITUTO DE ENSINO SUPERIOR DE FORTALEZA,Privada,Fortaleza,CE,Ativa
1873,FACULDADE MERCÚRIO,Privada,Rio de Janeiro,RJ,Extinta
4429,CENTRO UNIVERSITÁRIO UNIGRAN CAPITAL,Privada,Campo Grande,MS,Ativa
14927,FACULDADE ÚNICA DE FORMAÇÃO E ENSINO,Privada,São Gabriel da Palha,ES,Ativa
3365,FACULDADE UNIBRAS DA BAHIA,Privada,Juazeiro,BA,Ativa
1843,FACULDADE DE ADMINISTRAÇÃO DE CAMPO BELO,Privada,Campo Belo,MG,Ativa
22107,Faculdade Pitágoras de Itumbiara,Privada,Itumbiara,GO,Extinta
3617,FACULDADE DE CIÊNCIAS HUMANAS E EXATAS DO SERTÃO DO SÃO FRANCISCO,Privada,Belém de São Francisco,PE,Ativa
905,FACULDADE ESCOLA PAULISTA DE DIREITO,Privada,São Paulo,SP,Ativa
3339,Centro Universitário IDEAU,Privada,Getúlio Vargas,RS,Ativa
3584,INSTITUTO SUPERIOR DE EDUCAÇÃO SANTA CRUZ,Privada,Santa Cruz do Capibaribe,PE,Ativa
810,CENTRO TÉCNICO-EDUCACIONAL SUPERIOR DO OESTE PARANAENSE,Privada,Assis Chateaubriand,PR,Ativa
4422,FACULDADE DE TECNOLOGIA DO ABC,Privada,Santo André,SP,Extinta
23172,Faculdade de Educação Superior de Pouso Alegre,Privada,Pouso Alegre,MG,Ativa
25575,FACULDADE APARECIDA DE GOIÂNIA,Privada,Aparecida de Goiânia,GO,Ativa
23331,ALFA - Faculdade de Teófilo Otoni,Privada,Teófilo Otoni,MG,Ativa
1724,FACULDADE DE GUARARAPES,Privada,Guararapes,SP,Extinta
494,UNIVERSIDADE DO SUL DE SANTA CATARINA,Privada,Tubarão,SC,Ativa
528,PONTIFÍCIA UNIVERSIDADE CATÓLICA DO RIO DE JANEIRO,Privada,Rio de Janeiro,RJ,Ativa
3526,INSTITUTO DE ENSINO SUPERIOR MIGUEL DE CERVANTES,Privada,São José de Ribamar,MA,Extinta
1537,FACULDADE EXPONENCIAL,Privada,Chapecó,SC,Extinta
3161,"Instituto Federal de Educação, Ciência e Tecnologia do Sertão Pernambucano",Pública,Petrolina,PE,Ativa
1613,FACULDADE ADVENTISTA DO PARANÁ,Privada,Ivatuba,PR,Ativa
15452,CENTRO UNIVERSITÁRIO UNA DE BOM DESPACHO,Privada,Bom Despacho,MG,Ativa
2015,INSTITUTO SANTO TOMÁS DE AQUINO,Privada,Belo Horizonte,MG,Ativa
19406,FACULDADES INTEGRADAS CESUMAR DE ARAPONGAS,Privada,Arapongas,PR,Ativa
89,FUNDAÇÃO FACULDADES LUIZ MENEGHEL,Pública,Bandeirantes,PR,Extinta
2774,Centro Universitário UNIFAFIBE,Privada,Bebedouro,SP,Ativa
19283,Faculdade Pitagoras de Jacobina,Privada,Jacobina,BA,Extinta
24215,Faculdades Integradas Zona da Mata,Privada,Juiz de Fora,MG,Ativa
1328,Centro Universitário Unifacottur,Privada,Olinda,PE,Ativa
1136,FACULDADE DE CIÊNCIAS HUMANAS E SOCIAIS DE IGARASSU,Privada,Igarassu,PE,Ativa
25424,"Escola de Comunicação, Mídia e Informação",Privada,Rio de Janeiro,RJ,Ativa
4095,FACULDADE DE TECNOLOGIA E CIÊNCIAS DO DISTRITO FEDERAL,Privada,Brasília,DF,Extinta
22147,Faculdade de Ciências Jurídicas de Belo Jardim,Privada,Belo Jardim,PE,Ativa
1427,CENTRO UNIVERSITÁRIO DA SERRA GAÚCHA,Privada,Caxias do Sul,RS,Ativa
1987,FACULDADE DE FILOSOFIA CIÊNCIAS E LETRAS DEPUTADO JOSÉ LAVIOLA,Privada,Conselheiro Pena,MG,Extinta
1530,Faculdade CNEC Joinville,Privada,Joinville,SC,Ativa
208,UNIVERSIDADE DE RIBEIRÃO PRETO,Privada,Ribeirão Preto,SP,Ativa
22017,Faculdade Nossa Senhora Aparecida,Privada,Luziânia,GO,Ativa
23174,Centro de Ensino Superior de Nova Serrana,Privada,Nova Serrana,MG,Extinta
151,ESCOLA DE ADMINISTRAÇÃO DE EMPRESAS DE SÃO PAULO - FGV EAESP,Privada,São Paulo,SP,Ativa
3302,Faculdade REGES de Junqueirópolis,Privada,Junqueirópolis,SP,Ativa
24403,FACULDADE ATENAS SUL DE MINAS,Privada,Passos,MG,Ativa
588,UNIVERSIDADE TECNOLÓGICA FEDERAL DO PARANÁ,Pública,Curitiba,PR,Ativa
14996,FACULDADE DE GESTAO E NEGOCIOS DE SALVADOR,Privada,Salvador,BA,Ativa
18478,Faculdade Paulo Picanço,Privada,Fortaleza,CE,Ativa
915,FACULDADE DE ADMINISTRAÇÃO DE FÁTIMA DO SUL,Privada,Fátima do Sul,MS,Ativa
1850,Centro Universitário Santa Maria da Glória,Privada,Maringá,PR,Ativa
3669,FACULDADE DOM LUIS DE ORLEANS E BRAGANÇA,Privada,Ribeira do Pombal,BA,Ativa
17850,FACULDADE TECNOLÓGICA SANTANNA,Privada,Vinhedo,SP,Extinta
1371,FACULDADE DE MIRANDÓPOLIS,Privada,Mirandópolis,SP,Extinta
590,UNIVERSIDADE FEDERAL RURAL DA AMAZÔNIA,Pública,Belém,PA,Ativa
21487,FACULDADE DE INOVAÇÃO TECNOLÓGICA DE CAMPO GRANDE,Privada,Campo Grande,MS,Ativa
18497,Faculdade Maranhense,Privada,Parnarama,MA,Ativa
19206,FACULDADE UNIRB - FORTALEZA,Privada,Fortaleza,CE,Ativa
19358,Faculdade Thiago Ferreira,Privada,Guarujá,SP,Extinta
165,UNIVERSIDADE VEIGA DE ALMEIDA,Privada,Rio de Janeiro,RJ,Ativa
4256,Centro Universitário FIP-MOC,Privada,Montes Claros,MG,Ativa
