CODIGO_DA_IES,NOME_DA_IES,CATEGORIA_DA_IES,MUNICIPIO,UF,SITUACAO_IES
14727,FACULDADE PROGRESSO,Privada,Guarulhos,SP,Ativa
2183,CENTRO UNIVERSITÁRIO FUNDAÇÃO SANTO ANDRÉ,Privada,Santo André,SP,Ativa
2595,UNIVERSIDADE ESTADUAL DE LONDRINA,Pública,Londrina,PR,Extinta
1712,FACULDADE DE CIÊNCIAS E TECNOLOGIA DE TERESINA,Privada,Teresina,PI,Ativa
19716,Faculdade Integral de Jaboatão dos Guararapes,Privada,Jaboatão dos Guararapes,PE,Ativa
23200,Faculdade SOCIESC de Educação de Itajaí,Privada,Itajaí,SC,Ativa
2615,FACULDADE INCONFIDÊNCIA,Privada,Belo Horizonte,MG,Extinta
14951,FACULDADE DE ENGENHARIA E INOVAÇÃO TÉCNICO PROFISSI,Privada,Maringá,PR,Ativa
2096,FACULDADE DOCTUM DE MANHUAÇU - DOCTUM,Privada,Manhuaçu,MG,Ativa
21757,Fasul Educacional EaD,Privada,São Lourenço,MG,Ativa
6528,FACULDADE DE CIÊNCIAS APLICADAS DE LIMOEIRO,Pública,Belo Jardim,PE,Ativa
4094,Faculdade Estácio da Paraíba,Privada,João Pessoa,PB,Ativa
14157,Faculdade de Educação e Estudos Sociais de Uberlândia,Privada,Uberlândia,MG,Ativa
1418,Centro Universitário Toledo Wyden,Privada,Araçatuba,SP,Ativa
3393,FACULDADE DE ENSINO SUPERIOR DOM BOSCO,Privada,Cornélio Procópio,PR,Ativa
1851,ESCOLA BRASILEIRA DE ADMINISTRAÇÃO PÚBLICA E DE EMPRESAS,Privada,Rio de Janeiro,RJ,Ativa
279,FACULDADES INTEGRADAS HÉLIO ALONSO,Privada,Rio de Janeiro,RJ,Ativa
25774,FACULDADE ANCLIVEPA BRASÍLIA,Privada,Brasília,DF,Ativa
1520,FACULDADE FIA DE ADMINISTRAÇÃO E NEGÓCIOS,Privada,São Paulo,SP,Ativa
23202,Faculdade SOCIESC de Educação de São Bento do Sul,Privada,São Bento do Sul,SC,Ativa
11748,FACULDADE DE EDUCAÇÃO E CULTURA DE JI-PARANÁ,Privada,Ji-Paraná,RO,Ativa
1125,FACULDADES INTEGRADAS ESPÍRITA,Privada,Curitiba,PR,Ativa
2624,FACULDADE DO LITORAL PARANAENSE,Privada,Guaratuba,PR,Ativa
25791,Faculdade Brasileira Digital,Privada,São Paulo,SP,Ativa
17405,FACULDADE AFONSO MAFRENSE,Privada,São Raimundo Nonato,PI,Ativa
2501,CENTRO UNIVERSITÁRIO ESTÁCIO DE GOIÁS,Privada,Goiânia,GO,Ativa
1225,CENTRO UNIVERSITÁRIO AMPARENSE,Privada,Amparo,SP,Ativa
2466,FACUDADE IEDUCARE - FIED,Privada,Tianguá,CE,Ativa
1615,INSTITUTO SUPERIOR DO LITORAL DO PARANÁ,Privada,Paranaguá,PR,Ativa
9,UNIVERSIDADE ESTADUAL DE LONDRINA,Pública,Londrina,PR,Ativa
1629,INSTITUTO DE ENSINO SUPERIOR AQUIDAUANENSE,Privada,Aquidauana,MS,Extinta
14130,Faculdade Presidente Antônio Carlos de Várzea da Palma,Privada,Várzea da Palma,MG,Extinta
5627,FACULDADE DE TECNOLOGIA DE PRESIDENTE PRUDENTE,Pública,Presidente Prudente,SP,Ativa
19321,Faculdades Vale do Piancó,Privada,Itaporanga,PB,Ativa
161,CENTRO UNIVERSITÁRIO ASSUNÇÃO,Privada,São Paulo,SP,Ativa
21417,Centro de Instrução de Guerra Eletrônica,Pública,Brasília,DF,Ativa
4794,ESCOLA SUPERIOR DE ENGENHARIA E GESTÃO DE VALINHOS - ESEG,Privada,Valinhos,SP,Extinta
12735,FACULDADE DE CIÊNCIAS HUMANAS E SOCIAIS DO XINGU E AMAZÔNIA,Privada,Altamira,PA,Ativa
18106,FACULDADE COELHO NETO,Privada,Imperatriz,MA,Ativa
1506,Faculdade CNEC Itajaí,Privada,Itajaí,SC,Ativa
2033,INSTITUTO SUPERIOR DE EDUCAÇÃO DE FLORESTA,Privada,Floresta,PE,Extinta
454,FACULDADE CAMAQÜENSE DE CIÊNCIAS CONTÁBEIS E ADMINISTRATIVAS,Privada,Camaquã,RS,Ativa
1816,INSTITUTO DE ENSINO SUPERIOR DE BAURU,Privada,Bauru,SP,Ativa
5073,FACULDADE PITÁGORAS DE DIVINÓPOLIS,Privada,Divinópolis,MG,Extinta
2069,FACULDADE DE TEOLOGIA E CIÊNCIAS HUMANAS,Privada,Macapá,AP,Ativa
3230,FACULDADE LUIZ EDUARDO MAGALHÃES,Privada,Luís Eduardo Magalhães,BA,Ativa
22814,Faculdade Auden Educacional,Privada,São Paulo,SP,Ativa
926,Centro Universitário Anhanguera Pitágoras Unopar de Campo Grande,Privada,Campo Grande,MS,Ativa
704,FACULDADE DE CIÊNCIAS AGRÁRIAS DE ARARIPINA,Pública,Araripina,PE,Ativa
2375,FACULDADE VIZCAYA,Privada,Itapoá,SC,Extinta
14288,FACULDADE CATÓLICA DE SANTA CATARINA,Privada,Florianópolis,SC,Ativa
1252,FACULDADE PROMOVE DE MINAS GERAIS,Privada,Belo Horizonte,MG,Ativa
60,CENTRO UNIVERSITÁRIO MUNICIPAL DE FRANCA,Pública,Franca,SP,Ativa
1462,INSTITUTO PARAIBANO DE ENSINO RENOVADO,Privada,João Pessoa,PB,Ativa
24066,Faculdade Cristã da Cidade,Privada,São José dos Campos,SP,Ativa
22173,Faculdade - Uninorte  Barcarena,Privada,Barcarena,PA,Ativa
615,FACULDADE DE FILOSOFIA CIÊNCIAS E LETRAS PROFESSORA NAIR FORTES ABU-MERHY,Privada,Além Paraíba,MG,Extinta
663,UNIVERSIDADE SALGADO DE OLIVEIRA,Privada,São Gonçalo,RJ,Ativa
3333,CENTRO UNIVERSITÁRIO UNIFTEC,Privada,Caxias do Sul,RS,Ativa
15714,Fatec Arthur Azevedo - Mogi Mirim,Pública,Moji Mirim,SP,Ativa
1962,INSTITUTO SUPERIOR DE EDUCAÇÃO DO CENTRO EDUCACIONAL NOSSA SENHORA AUXILIADORA,Privada,Campos dos Goytacazes,RJ,Ativa
1366,FACULDADE BARDDAL,Privada,Florianópolis,SC,Extinta
15669,FACULDADE DE CIÊNCIAS EXATAS DE GARANHUNS,Pública,Garanhuns,PE,Extinta
3688,FACULDADES INTEGRADAS DO VALE DO IVAÍ,Privada,Ivaiporã,PR,Ativa
322,UNIVERSIDADE PAULISTA,Privada,São Paulo,SP,Ativa
14231,Faculdade Presidente Antônio Carlos de Uruana de Minas,Privada,Uruana de Minas,MG,Extinta
3432,"FACULDADES INTEGRADAS DE CIÊNCIAS HUMANAS, SAÚDE E EDUCAÇÃO DE GUARULHOS",Privada,Guarulhos,SP,Ativa
18626,Faculdade Pitágoras de Arapiraca,Privada,Arapiraca,AL,Extinta
18033,FACULDADE DE TEODORO SAMPAIO,Privada,Teodoro Sampaio,SP,Ativa
3164,"INSTITUTO FEDERAL DE EDUCAÇÃO, CIÊNCIA E TECNOLOGIA DE MATO GROSSO",Pública,Cuiabá,MT,Ativa
599,"INSTITUTO FEDERAL DE EDUCAÇÃO, CIÊNCIA E TECNOLOGIA DA BAHIA",Pública,Salvador,BA,Ativa
23358,Centro de Ensino Superior SOCIESC de Jaraguá do Sul,Privada,Jaraguá do Sul,SC,Ativa
25412,Faculdade Metropolitana de Franca,Privada,Franca,SP,Ativa
4756,CENTRO UNIVERSITÁRIO MUNICIPAL DE SÃO JOSÉ,Pública,São José,SC,Ativa
23973,Centro de Ensino Superior de Altamira,Privada,Altamira,PA,Ativa
37,FACULDADE DE TECNOLOGIA DE JAHU,Pública,Jaú,SP,Ativa
23159,FACULDADE BARÃO DE JEQUIRIÇA,Privada,Valença,BA,Ativa
3853,Centro Universitário Maurício de Nassau de Natal,Privada,Natal,RN,Ativa
23164,Centro de Ensino Superior de Divinópolis,Privada,Divinópolis,MG,Ativa
12052,FACULDADE DE TECNOLOGIA SENAI PAULO DE TARSO,Privada,Belo Horizonte,MG,Extinta
3746,FACULDADE IBRA DA GRANDE SÃO PAULO,Privada,São Paulo,SP,Ativa
24679,FACULDADE HOLÍSTICA,Privada,Curitiba,PR,Ativa
19256,Faculdade Pitágoras de Brumado,Privada,Brumado,BA,Ativa
17109,FACULDADE ITPAC GARANHUNS,Privada,Garanhuns,PE,Extinta
11584,FACULDADE CAL DE ARTES CÊNICAS,Privada,Rio de Janeiro,RJ,Ativa
345,ESCOLA DE ENGENHARIA KENNEDY,Privada,Belo Horizonte,MG,Ativa
2846,FACULDADE DE TEOLOGIA UMBANDISTA,Privada,São Paulo,SP,Extinta
24391,Faculdade de Educação da Ibiapaba,Privada,Ipu,CE,Ativa
2180,RATIO - FACULDADE TEOLÓGICA E FILOSÓFICA,Privada,Fortaleza,CE,Ativa
4867,FACULDADE ANHANGUERA DE GUARAPARI,Privada,Guarapari,ES,Ativa
22456,FACULDADE REALIZA,Privada,Aparecida de Goiânia,GO,Ativa
3990,FACULDADE SÃO BERNARDO DE TECNOLOGIA,Privada,São Bernardo do Campo,SP,Extinta
694,UNIVERSIDADE FEDERAL DE MATO GROSSO DO SUL,Pública,Campo Grande,MS,Ativa
547,UNIVERSIDADE DO ESTADO DO RIO DE JANEIRO,Pública,Rio de Janeiro,RJ,Ativa
21955,FACULDADE METROPOLITANA DE ITAJAÍ,Privada,Itajaí,SC,Ativa
5045,FACULDADE DE TECNOLOGIA PAULISTA,Privada,Lupércio,SP,Ativa
19785,FACULDADE ANHANGUERA DE RIBEIRÃO DAS NEVES,Privada,Ribeirão das Neves,MG,Ativa
5107,FACULDADE SOGIPA DE EDUCAÇÃO FÍSICA,Privada,Porto Alegre,RS,Ativa
2361,FACULDADE PADRÃO,Privada,Aparecida de Goiânia,GO,Ativa
21371,Faculdade Univeritas Universus Veritas de Joinville,Privada,Joinville,SC,Extinta
1913,CENTRO UNIVERSITÁRIO FAMINAS,Privada,Muriaé,MG,Ativa
17874,Faculdade de Educação Superior de Tangará da Serra,Privada,Tangará da Serra,MT,Ativa
1042,UNIVERSIDADE POSITIVO,Privada,Curitiba,PR,Ativa
3604,INSTITUTO SUPERIOR DE EDUCAÇÃO DE CARIACICA,Privada,Cariacica,ES,Extinta
945,Faculdade Funorte de Januária,Privada,Januária,MG,Ativa
1059,FACULDADE LOURENÇO FILHO,Privada,Fortaleza,CE,Ativa
13873,FACULDADE FINOM DE PATOS DE MINAS,Privada,Patos de Minas,MG,Ativa
1788,FACULDADE DE ADMINISTRAÇÃO E ARTES DE LIMEIRA,Privada,Limeira,SP,Ativa
2192,INSTITUTO SUPERIOR DE EDUCAÇÃO IVOTI,Privada,Ivoti,RS,Ativa
109,FACULDADES INTEGRADAS RUI BARBOSA,Privada,Andradina,SP,Ativa
14155,Faculdade Presidente Antônio Carlos de Sabará,Privada,Sabará,MG,Ativa
13538,FACULDADE CARAGUÁ,Privada,Caraguatatuba,SP,Extinta
1677,FACULDADE DE ENSINO SUPERIOR DO PIAUÍ,Privada,Teresina,PI,Ativa
21937,FACULDADE INTEGRADA DE CAMPO GRANDE,Privada,Campo Grande,MS,Ativa
1924,FACULDADE DO NORTE PIONEIRO DE JACAREZINHO,Privada,Jacarezinho,PR,Extinta
5015,INSTITUTO SUPERIOR DE TECNOLOGIA EM HORTICULTURA,Pública,Campos dos Goytacazes,RJ,Ativa
2973,FACULDADE ANHANGUERA DE PRIMAVERA DO LESTE,Privada,Primavera do Leste,MT,Ativa
1416,FACULDADE GRANDE VITÓRIA,Privada,Serra,ES,Extinta
24861,FACULDADE ATENAS DO SUL BAIANO,Privada,Valença,BA,Ativa
16967,FACULDADE SENAI RIO,Privada,Rio de Janeiro,RJ,Ativa
17269,INSTITUTO DE EDUCAÇÃO SUPERIOR E INOVAÇÃO PERSONA,Privada,São Paulo,SP,Ativa
1426,INSTITUTO LUTERANO DE ENSINO SUPERIOR DE ITUMBIARA,Privada,Itumbiara,GO,Ativa
3692,FACULDADE DE TECNOLOGIA IPEP DE CAMPINAS,Privada,Campinas,SP,Ativa
25282,UNIVERSIDADE FEDERAL DE JATAÍ,Pública,Jataí,GO,Ativa
18266,FACULDADE SAINT GERMAIN SP,Privada,São Paulo,SP,Extinta
2922,INSTITUTO SUPERIOR DE EDUCAÇÃO DE BARRETOS,Privada,Barretos,SP,Ativa
24290,Faculdade Andreotti de Maringá,Privada,Maringá,PR,Ativa
18039,Faculdade Capacitar,Privada,Bagé,RS,Ativa
3754,FACULDADES INTEGRADAS ADVENTISTAS DE MINAS GERAIS,Privada,Lavras,MG,Ativa
967,FACULDADE DE TECNOLOGIA DE TAQUARITINGA,Pública,Taquaritinga,SP,Ativa
2126,ESCOLA DE DIREITO DO RIO DE JANEIRO,Privada,Rio de Janeiro,RJ,Ativa
1192,FACULDADE DE CIÊNCIAS DA SAÚDE DE SÃO PAULO,Privada,São Paulo,SP,Ativa
19910,Faculdades Planalto Central,Privada,Brasília,DF,Ativa
2632,FACULDADES INTEGRADAS DO EXTREMO SUL DA BAHIA,Privada,Eunápolis,BA,Ativa
3149,Faculdade Anhanguera De Divinópolis,Privada,Divinópolis,MG,Ativa
24471,FACULDADE ATENAS VALENÇA,Privada,Valença,BA,Ativa
21716,FACULDADE CESMA DE MARACANAÚ,Privada,Maracanaú,CE,Ativa
16459,FACULDADE UNIRB - SALVADOR,Privada,Salvador,BA,Ativa
795,FACULDADES INTEGRADAS DE DIAMANTINO,Privada,Diamantino,MT,Ativa
18692,Faculdade ALFAUNIPAC de Guanhães,Privada,Guanhães,MG,Ativa
2441,INSTITUTO SUPERIOR DE EDUCAÇÃO AUXILIUM,Privada,Lins,SP,Extinta
16225,Faculdade Regional do Jacuípe,Privada,Capim Grosso,BA,Ativa
3783,FACULDADE PARAENSE DE ENSINO,Privada,Belém,PA,Ativa
1623,FACULDADE DE CIÊNCIAS AGRÁRIAS DE ANDRADINA,Privada,Andradina,SP,Ativa
4731,FACULDADE MESSIANICA,Privada,São Paulo,SP,Ativa
3817,Centro Universitário Maurício de Nassau de João Pessoa,Privada,João Pessoa,PB,Ativa
591,UNIVERSIDADE FEDERAL DE SÃO PAULO,Pública,São Paulo,SP,Ativa
22917,FACULDADE DE CIÊNCIAS MÉDICAS DE MARICÁ,Privada,Maricá,RJ,Ativa
1757,"ESCOLA SUPERIOR DE ADMINISTRAÇÃO, MARKETING E COMUNICAÇÃO DE GOIÂNIA",Privada,Goiânia,GO,Extinta
3513,FACULDADE DE PRESIDENTE VENCESLAU,Privada,Presidente Venceslau,SP,Ativa
3974,UNIVERSIDADE DE RIO VERDE,Pública,Rio Verde,GO,Ativa
3157,INSTITUTO SUPERIOR DE EDUCAÇÃO ALMEIDA RODRIGUES,Privada,Rio Verde,GO,Ativa
18639,Faculdade Pitágoras de Bacabal,Privada,Bacabal,MA,Ativa
385,UNIVERSIDADE SALVADOR,Privada,Salvador,BA,Ativa
14,UNIVERSIDADE DO VALE DO RIO DOS SINOS,Privada,São Leopoldo,RS,Ativa
1487,CENTRO UNIVERSITÁRIO UNIDOM - BOSCO,Privada,Curitiba,PR,Ativa
22202,Faculdade Estácio de Juazeiro,Privada,Juazeiro,BA,Ativa
1969,FACULDADE DOS IMIGRANTES - FAI,Privada,Caxias do Sul,RS,Extinta
2075,INSTITUTO DE ENSINO SUPERIOR DE ALAGOAS,Privada,Maceió,AL,Ativa
809,FACULDADE DE DIREITO E CIÊNCIAS SOCIAIS DO LESTE DE MINAS - FADILESTE,Privada,Reduto,MG,Ativa
15859,Faculdade Católica Paulista,Privada,Marília,SP,Ativa
24843,INSTITUTO DE ASSISTÊNCIA MÉDICA AO SERVIDOR PÚBLICO ESTADUAL,Pública,São Paulo,SP,Ativa
21519,Faculdade Meridional de Porto Alegre,Privada,Porto Alegre,RS,Ativa
2111,CENTRO UNIVERSITÁRIO INTA,Privada,Sobral,CE,Ativa
2677,INSTITUTO SUPERIOR DE EDUCAÇÃO SÃO JUDAS TADEU,Privada,Floriano,PI,Extinta
750,UNIVERSIDADE DE GURUPI,Pública,Gurupi,TO,Ativa
5066,FACULDADE PITÁGORAS DE TECNOLOGIA DE CONTAGEM,Privada,Contagem,MG,Extinta
19501,Faculdade de Tecnologia Sebrae,Pública,São Paulo,SP,Ativa
14210,Faculdade Presidente Antônio Carlos de Maria da Fé,Privada,Maria da Fé,MG,Extinta
2120,INSTITUTO DE FILOSOFIA E DE TEOLOGIA PAULO VI,Privada,Nova Iguaçu,RJ,Extinta
1507,FACULDADE PROJEÇÃO DE CEILÂNDIA,Privada,Brasília,DF,Ativa
7,UNIVERSIDADE FEDERAL DE SÃO CARLOS,Pública,São Carlos,SP,Ativa
20667,UNETRI FACULDADES,Privada,Barracão,PR,Ativa
18296,Faculdade AGES de Tucano,Privada,Tucano,BA,Ativa
18526,FACULDADE DE OSASCO,Privada,Osasco,SP,Ativa
21871,FACULDADE BAHIANA DE ENGENHARIA E CIÊNCIAS SOCIAIS APLICADAS,Privada,Salvador,BA,Ativa
24056,Faculdade de Saúde do Sertão de Pernambuco,Privada,Floresta,PE,Ativa
13944,FACULDADE DE ADMINISTRAÇÃO E NEGÓCIOS,Privada,Maceió,AL,Ativa
1961,INSTITUTO TECNOLÓGICO E DAS CIÊNCIAS SOCIAIS APLICADAS E DA SAÚDE DO CENTRO EDUC. N. SRª AUXILIADORA,Privada,Campos dos Goytacazes,RJ,Ativa
5217,FACULDADES INTEGRADAS PAULISTA,Privada,São Paulo,SP,Ativa
17783,Faculdade de Mediação Ívia Corneli,Privada,Nova Lima,MG,Ativa
467,FACULDADE DE CIÊNCIAS CONTÁBEIS DE ITAPETININGA,Privada,Itapetininga,SP,Extinta
2131,FACULDADE DE SÃO BERNARDO DO CAMPO,Privada,São Bernardo do Campo,SP,Ativa
26443,International Orofacial Academy RP,Privada,Ribeirão Preto,SP,Ativa
15382,FACULDADE AJES,Privada,Juína,MT,Ativa
1327,ESCOLA SUPERIOR DE PROPAGANDA E MARKETING DE PORTO ALEGRE,Privada,Porto Alegre,RS,Ativa
24223,Faculdade de Tecnologia da Amazônia,Privada,Manaus,AM,Ativa
1309,Faculdade Projeção de Taguatinga Norte,Privada,Brasília,DF,Ativa
3879,Centro Universitário Maurício de Nassau de Campina Grande,Privada,Campina Grande,PB,Ativa
3782,FACULDADE DE TECNOLOGIA CACHOEIRO DE ITAPEMIRIM,Privada,Cachoeiro de Itapemirim,ES,Ativa
17680,FACULDADE EVANGÉLICA DE SENADOR CANEDO,Privada,Senador Canedo,GO,Ativa
18046,FACULDADE ILAPEO,Privada,Curitiba,PR,Ativa
1935,FACULDADE SÃO PAULO DE SANTOS,Privada,Santos,SP,Extinta
3541,FACULDADE DE TAPEJARA,Privada,Tapejara,RS,Ativa
5,UNIVERSIDADE FEDERAL DO PIAUÍ,Pública,Teresina,PI,Ativa
15522,"INSTITUTO FEDERAL DE EDUCAÇÃO, CIÊNCIA E TECNOLOGIA DO AMAPÁ",Pública,Macapá,AP,Ativa
21812,Faculdade Regional de Leopoldina,Privada,Leopoldina,MG,Ativa
17657,Faculdade Professor Daltro,Privada,Rio de Janeiro,RJ,Ativa
47,UNIVERSIDADE ESTADUAL DE GOIÁS,Pública,Anápolis,GO,Ativa
1831,FACULDADE DE IBITINGA,Privada,Ibitinga,SP,Extinta
4544,FACULDADE LÍDER,Privada,São Lourenço da Mata,PE,Extinta
4045,Centro Universitário UniCuritiba,Privada,Curitiba,PR,Ativa
1118,FACULDADE DE MIRASSOL,Privada,Mirassol,SP,Ativa
14227,Faculdade Presidente Antônio Carlos de Recreio,Privada,Recreio,MG,Extinta
2142,FACULDADE MULTIEDUCATIVA,Privada,Brasília,DF,Extinta
543,FACULDADE DE CIÊNCIAS DA FUNDAÇÃO INSTITUTO TECNOLÓGICO DE OSASCO,Pública,Osasco,SP,Ativa
21366,FACULDADE FAEL DE CURITIBA,Privada,Curitiba,PR,Ativa
1988,CENTRO UNIVERSITARIO AVANTIS,Privada,Balneário Camboriú,SC,Ativa
2598,FACULDADE PENSAR,Privada,Salvador,BA,Extinta
21977,Faculdade Poliensino - FP,Privada,Cuiabá,MT,Ativa
1061,FACULDADE PLANALTO DE ADMINISTRAÇÃO E CIÊNCIAS ECONÔMICAS,Privada,Brasília,DF,Extinta
2660,FACULDADE PHÊNIX DE CIÊNCIAS HUMANAS E SOCIAIS DO BRASIL,Privada,Santo Antônio do Descoberto,GO,Extinta
13724,PANAMERICANA FACULDADE DE ARTE E DESIGN,Privada,São Paulo,SP,Extinta
21210,Faculdade Estratego,Privada,Belém,PA,Ativa
12533,FACULDADE DOM BOSCO DE CAPITÃO LEÔNIDAS MARQUES,Privada,Capitão Leônidas Marques,PR,Ativa
20406,Faculdade Jaguar Indaiá,Privada,Indaiatuba,SP,Ativa
4108,INSTITUTO CATÓLICO DE ESTUDOS SUPERIORES DO PIAUÍ,Privada,Teresina,PI,Ativa
2915,FACULDADE CIDADE DE PATOS DE MINAS,Privada,Patos de Minas,MG,Ativa
22685,"Centro de Medicina Especializada, Pesquisa e Ensino",Privada,Belo Horizonte,MG,Ativa
23798,Faculdade de Ciências e Educação em Saúde,Privada,Recife,PE,Ativa
18659,FACULDADE ANHANGUERA DO CEARÁ,Privada,Fortaleza,CE,Ativa
966,FACULDADE DE TURISMO - SANTOS DUMONT,Privada,Santos Dumont,MG,Extinta
18048,Faculdade Vértix Trirriense,Privada,Três Rios,RJ,Ativa
17666,FACULDADE ANHANGUERA UNIDADE PARAGOMINAS,Privada,Paragominas,PA,Ativa
3268,FACULDADE MADRE THAIS,Privada,Ilhéus,BA,Ativa
1084,CENTRO UNIVERSITÁRIO CNEC DE BENTO GONÇALVES,Privada,Bento Gonçalves,RS,Ativa
4681,FACULDADE CENTRO PAULISTANO,Privada,São Paulo,SP,Ativa
23342,Faculdade Avantis de Florianópolis,Privada,Florianópolis,SC,Ativa
4399,FACULDADE DE BALSAS,Privada,Balsas,MA,Ativa
4785,INSTITUTO FEDERAL DE EDUCAÇÃO CIÊNCIA E TECNOLOGIA DE RONDÔNIA,Pública,Porto Velho,RO,Ativa
797,Faculdade AVEC de Vilhena,Privada,Vilhena,RO,Ativa
640,Faculdade Maria Thereza,Privada,Niterói,RJ,Ativa
21674,Faculdade Promove de Alfenas,Privada,Alfenas,MG,Ativa
708,INSTITUTO DE CIÊNCIAS SOCIAIS APLICADAS,Privada,Brasília,DF,Extinta
68,FACULDADE DE FILOSOFIA CIÊNCIAS E LETRAS DE PENÁPOLIS,Privada,Penápolis,SP,Ativa
15447,Centro Universitário Presidente Antônio Carlos de Barbacena,Privada,Barbacena,MG,Extinta
1196,UNIVERSIDADE CESUMAR,Privada,Maringá,PR,Ativa
3975,FACULDADE SÃO FRANCISCO DE PIUMHI,Privada,Piumhi,MG,Extinta
417,UNIVERSIDADE CIDADE DE SÃO PAULO,Privada,São Paulo,SP,Ativa
14879,FACULDADE DOURADO,Privada,São Paulo,SP,Ativa
23409,FACULDADE CENTRO SÃO PAULO,Privada,São Paulo,SP,Ativa
5000,"Faculdade Ágora - Administração, Educação e Cultura",Privada,Curitiba,PR,Ativa
404,FACULDADES INTEGRADAS DA UPIS,Privada,Brasília,DF,Ativa
17115,FACULDADE TRÊS MARIAS,Privada,João Pessoa,PB,Ativa
19172,Faculdades Integradas Aparício Carvalho Vilhena,Privada,Vilhena,RO,Ativa
3376,FACULDADE DE TEOLOGIA INTEGRADA,Privada,Igarassu,PE,Ativa
25450,Faculdades Integradas do Sul de Minas - FISMINAS,Privada,Belo Horizonte,MG,Ativa
5112,FACULDADE UNIÃO ARARUAMA DE ENSINO S/S LTDA.,Privada,Araruama,RJ,Extinta
200,FACULDADE CÁSPER LÍBERO,Privada,São Paulo,SP,Ativa
23707,FACULDADE DE TECNOLOGIA E EDUCAÇÃO SUPERIOR E PROFISSIONALIZ,Privada,Formosa,GO,Ativa
2072,FACULDADE DE DESENVOLVIMENTO SUSTENTÁVEL DE CRUZEIRO DO SUL,Privada,Cruzeiro do Sul,AC,Ativa
1275,FACULDADE DO GUARUJÁ,Privada,Guarujá,SP,Ativa
12522,FACULDADE MOGIANA DO ESTADO DE SÃO PAULO,Privada,Mogi Guaçu,SP,Ativa
775,FACULDADE ALVORADA DE EDUCAÇÃO FÍSICA E DESPORTO,Privada,Brasília,DF,Extinta
1946,FACULDADE LEGALE,Privada,São Paulo,SP,Ativa
1363,FACULDADE VISCONDE DE CAIRÚ,Privada,Salvador,BA,Ativa
717,FUNDAÇÃO UNIVERSIDADE FEDERAL DE CIÊNCIAS DA SAÚDE DE PORTO ALEGRE,Pública,Porto Alegre,RS,Ativa
22712,FACULDADE PITÁGORAS UNOPAR DE MURIAÉ,Privada,Muriaé,MG,Ativa
1651,FACULDADE DE EDUCAÇÃO,Privada,Vitória,ES,Extinta
1824,FACULDADE DE CIÊNCIAS CONTÁBEIS DE ITABIRITO,Privada,Itabirito,MG,Extinta
861,CENTRO DE ENSINO SUPERIOR DO AMAPÁ,Privada,Macapá,AP,Ativa
23147,Faculdade do Comércio de São Paulo,Privada,São Paulo,SP,Ativa
2438,INSTITUTO TEOLÓGICO PASTORAL DO CEARÁ,Privada,Fortaleza,CE,Extinta
532,UNIVERSIDADE REGIONAL DO NOROESTE DO ESTADO DO RIO GRANDE DO SUL,Privada,Ijuí,RS,Ativa
24356,Faculdade Virtual do Brasil,Privada,São Paulo,SP,Ativa
5518,FACULDADE GUARAPUAVA,Privada,Guarapuava,PR,Ativa
15716,Centro Educacional em Aeronáutica,Pública,Belo Horizonte,MG,Extinta
22747,FACULDADE PROF. LUÍZ MÁRIO D'AVILA,Privada,Barretos,SP,Ativa
21669,Faculdade Kennedy de Ipatinga,Privada,Ipatinga,MG,Ativa
1842,FACULDADES INTEGRADAS MACHADO DE ASSIS,Privada,Santa Rosa,RS,Ativa
672,CENTRO UNIVERSITÁRIO FACENS,Privada,Sorocaba,SP,Ativa
24548,ITPAC ITACOATIARA,Privada,Itacoatiara,AM,Ativa
21589,Faculdade Maurício de Nassau de Caxias do Sul,Privada,Caxias do Sul,RS,Extinta
4104,ESCOLA SUPERIOR DE ENGENHARIA E GESTÃO DE SÃO PAULO - ESEG,Privada,São Paulo,SP,Ativa
19842,CENTRO DE ENSINO SUPERIOR DE BACABEIRA,Privada,Bacabeira,MA,Ativa
24991,FACULDADE DE EDUCAÇÃO VALE DO PAJEÚ,Privada,Bezerros,PE,Ativa
4633,Faculdade IDEAU de Passo Fundo,Privada,Passo Fundo,RS,Ativa
10685,Faculdade Multivix São Mateus,Privada,São Mateus,ES,Ativa
14738,"FACULDADE FELUMA - SAÚDE, TECNOLOGIA E CIÊNCIA",Privada,Lagoa Santa,MG,Ativa
25716,IPD INSTITUTO DE PROFISSIONALIZAÇÃO DIGITAL,Privada,São Paulo,SP,Ativa
12611,FACULDADE DE MÚSICA SOUZA LIMA,Privada,São Paulo,SP,Ativa
144,FACULDADE DE CIÊNCIAS HUMANAS DE OLINDA,Privada,Olinda,PE,Ativa
1256,FACULDADE DOM BOSCO,Privada,Cascavel,PR,Ativa
362,FACULDADE PAULISTA DE SERVIÇO SOCIAL,Privada,São Paulo,SP,Ativa
15775,Faculdade de Tecnologia Professor Fernando Amaral de Almeida Prado,Pública,Araçatuba,SP,Extinta
367,UNIVERSIDADE ESTADUAL DE MONTES CLAROS,Pública,Montes Claros,MG,Ativa
2565,ABEU - CENTRO UNIVERSITÁRIO,Privada,Belford Roxo,RJ,Ativa
1317,Centro Universitário Sudoeste Paulista,Privada,Avaré,SP,Ativa
21574,FACULDADE EGAS MONIZ,Privada,Recife,PE,Ativa
4567,FACULDADE CENTRO MATO-GROSSENSE,Privada,Sorriso,MT,Ativa
3304,CENTRO UNIVERSITÁRIO DE PATOS,Privada,Patos,PB,Ativa
22190,Faculdade de Ciências Jurídicas de Sao João da Boa Vista,Privada,São João da Boa Vista,SP,Extinta
1509,Centro Universitário Estácio de Belo Horizonte - Estácio BH,Privada,Belo Horizonte,MG,Ativa
4995,Faculdade Educamais,Privada,São Paulo,SP,Ativa
17118,Faculdade do Norte de Mato Grosso,Privada,Guarantã do Norte,MT,Ativa
3226,FACULDADE DE MEDICINA,Privada,Araguaína,TO,Ativa
934,FACULDADE SÃO CARLOS,Privada,São Bernardo do Campo,SP,Extinta
159,FACULDADE NOVA ROMA CARUARU,Privada,Caruaru,PE,Ativa
2191,FACULDADE ANHANGUERA DE PELOTAS,Privada,Pelotas,RS,Ativa
2564,UNIVERSIDADE FEDERAL DE CAMPINA GRANDE,Pública,Campina Grande,PB,Ativa
14149,Faculdade Presidente Antônio Carlos de Bocaiúva,Privada,Bocaiúva,MG,Extinta
4294,FACULDADE SENAC JARAGUÁ DO SUL,Privada,Jaraguá do Sul,SC,Ativa
1554,CENTRO UNIVERSITÁRIO DO VALE DO RIBEIRA,Privada,Registro,SP,Ativa
17116,Faculdade de Ciências de Goiana,Privada,Goiana,PE,Ativa
2754,Faculdade Estácio São Paulo de Rondônia,Privada,Rolim de Moura,RO,Ativa
2861,FACULDADE DE ITAPETININGA,Privada,Itapetininga,SP,Extinta
1454,FACULDADE SALESIANA DO NORDESTE,Privada,Recife,PE,Ativa
2023,Centro Universitário FG,Privada,Guanambi,BA,Ativa
594,CENTRO FEDERAL DE EDUCAÇÃO TECNOLÓGICA DE MINAS GERAIS,Pública,Belo Horizonte,MG,Ativa
23242,Escola Superior São Judas de São Bernardo do Campo,Privada,São Bernardo do Campo,SP,Ativa
25640,Faculdade de Ciências Educacionais e Tecnologias Integradas,Privada,Vitória,ES,Ativa
12928,FACULDADE CGESP GOIANIA,Privada,Goiânia,GO,Ativa
19229,FACULDADE PRESBITERIANA MACKENZIE BRASILIA,Privada,Brasília,DF,Ativa
3981,FACULDADE DE CURITIBA,Privada,Curitiba,PR,Extinta
26,ESCOLA NACIONAL DE CIÊNCIAS ESTATÍSTICAS,Pública,Rio de Janeiro,RJ,Ativa
18025,FACULDADE DE EDUCAÇÃO SUPERIOR DE CHAPECÓ,Privada,Chapecó,SC,Ativa
5370,Centro Universitário Doctum de Teófilo Otoni,Privada,Teófilo Otoni,MG,Ativa
18653,Faculdade Uninassau Garanhuns,Privada,Garanhuns,PE,Ativa
1516,FACULDADE DE VINHEDO,Privada,Vinhedo,SP,Extinta
14914,FACULDADE TEOLÓGICA EVANGÉLICA DO RIO DE JANEIRO,Privada,Rio de Janeiro,RJ,Extinta
1552,Centro Universitário Maurício de Uninassau de Parnaíba,Privada,Parnaíba,PI,Ativa
13749,FACULDADE EDUCACIONAL ARAUCÁRIA,Privada,Curitiba,PR,Ativa
3415,FACULDADE DE TECNOLOGIA DE CAXIAS DO SUL,Privada,Caxias do Sul,RS,Extinta
2266,FACULDADE UNIÃO DE GOYAZES FORMOSA,Privada,Formosa,GO,Ativa
2805,FACULDADE MODELO,Privada,Curitiba,PR,Ativa
2836,FACULDADE SUL DA AMÉRICA,Privada,Aparecida de Goiânia,GO,Ativa
3948,FACULDADE SENAC BLUMENAU,Privada,Blumenau,SC,Ativa
21505,FACULDADE PRISMA DE APUCARANA,Privada,Apucarana,PR,Ativa
519,UNIVERSIDADE CATÓLICA DO SALVADOR,Privada,Salvador,BA,Ativa
3299,FACULDADE DE TECNOLOGIA INFORMÁTICA,Privada,Fortaleza,CE,Ativa
2189,FACULDADE DO MARANHÃO,Privada,São Luís,MA,Ativa
1450,CENTRO UNIVERSITÁRIO DO CERRADO-PATROCÍNIO,Privada,Patrocínio,MG,Ativa
14860,FACULDADE TECNOLÓGICA DENTAL CEEO,Privada,Igrejinha,RS,Ativa
3920,FACULDADE DE TECNOLOGIA SENAI ROBERTO MANGE,Privada,Anápolis,GO,Ativa
1815,FACULDADE DO INSTITUTO BRASIL,Privada,Anápolis,GO,Ativa
2636,FACULDADE DINÂMICA DO VALE DO PIRANGA,Privada,Ponte Nova,MG,Ativa
14975,FACULDADE DO NORDESTE DA BAHIA,Privada,Coronel João Sá,BA,Ativa
21415,FACULDADE UNA DE NOVA SERRANA,Privada,Nova Serrana,MG,Extinta
18978,Faculdade Rebouças de Campina Grande,Privada,Campina Grande,PB,Ativa
1841,CENTRO UNIVERSITÁRIO ANTÔNIO EUFRÁSIO DE TOLEDO DE PRESIDENTE PRUDENTE - TOLEDO PRUDENTE,Privada,Presidente Prudente,SP,Ativa
14326,FACULDADE DE TECNOLOGIA INSAEOS,Privada,Cascavel,PR,Extinta
1637,FACULDADE DELMIRO GOUVEIA,Privada,Maceió,AL,Ativa
5048,FACULDADE DE TEOLOGIA DE SÃO PAULO DA IGREJA PRESBITERIANA INDEPENDENTE DO BRASIL,Privada,São Paulo,SP,Ativa
17777,FACULDADE SENAC CONCÓRDIA,Privada,Concórdia,SC,Ativa
14246,Faculdade Presidente Antônio Carlos de Uberaba,Privada,Uberaba,MG,Ativa
1926,FACULDADE DE ADMINISTRAÇÃO DE CATAGUASES,Privada,Cataguases,MG,Ativa
13743,Faculdade Anhanguera de Governador Valadares,Privada,Governador Valadares,MG,Ativa
2222,Centro Universitário do Rio São Francisco Unirios,Privada,Paulo Afonso,BA,Ativa
1618,CENTRO UNIVERSITÁRIO SOCIESC DE BLUMENAU,Privada,Blumenau,SC,Ativa
24074,"Faculdade de Gestão, Educação e de Saúde",Privada,Cuiabá,MT,Ativa
2264,FACULDADE DE COMUNICAÇÃO ANHANGUERA UNIDADE GUARAPARI,Privada,Guarapari,ES,Ativa
14229,Faculdade Presidente Antônio Carlos de São Vicente de Minas,Privada,São Vicente de Minas,MG,Extinta
2941,INSTITUTO SUPERIOR DE TEOLOGIA E PASTORAL DE BONFIM,Privada,Senhor do Bonfim,BA,Extinta
13648,FACULDADE DE SÃO MARCOS,Privada,São Marcos,RS,Ativa
24922,FACULDADE SÃO VICENTE DE IRATI,Privada,Irati,PR,Ativa
